Research name,Publication Title,Author List,Conf/Journal Details,Citation count,Year
Alan F. Smeaton,Querying XML data streams from wireless sensor networks: An evaluation of query engines,"Martin O Connor, Kenneth Conroy, Mark Roantree, Alan F. Smeaton, Niall Moyna",Research Challenges in Information Science 2009. RCIS 2009. Third …,7,2009
Alan F. Smeaton,"Collaborative searching: social searching, together",Alan F. Smeaton,,0,2009
Alan F. Smeaton,Managing a life of lifelogged SenseCam images,Alan F. Smeaton,,0,2009
Alan F. Smeaton,Performance-aware replication of distributed pre-recorded IPTV content,"Seung-Bum Lee, Gabriela Magureanu, Alan F. Smeaton",IEEE Transactions on Broadcasting 55 (2) 516-526,73,2009
Alan F. Smeaton,"Video-4-Video: using video for searching, classifying and summarising video",Alan F. Smeaton,IWV 2009-International Workshop on Video 25-27,0,2009
Alan F. Smeaton,The TRECVid 2008 BBC Rushes Summarization Evaluation| NIST,"Paul Over, Alan F. Smeaton, George Awad",ACM Conference on Multimedia 2008,0,2009
Alan F. Smeaton,CHARACTERIZATION OF SOLID STATE LIGHTING PRODUCTS FOR MEASUREMENT INTERCOMPARISONS,C Cameron Miller,,0,2009
Alan F. Smeaton,Video Semantics and the Sensor Web,Alan F. Smeaton,European Semantic Web Conference 3-3,0,2009
Alan F. Smeaton,"Views from the coalface: chemo-sensors, sensor networks and the semantic sensor web","Jer Hayes, Edel O’Connor, John Cleary, Hr Kolar, Robert Mccarthy, Richard Tynan, Greg Mp O’Hare, Alan F. Smeaton, Noel O’Connor, Dermot Diamond",1st International Workshop on the Semantic Sensor Web (SemSensWeb 2009 …,11,2009
Alan F. Smeaton,Content based access to digital libraries,Alan F. Smeaton,,0,2009
Alan F. Smeaton,Query independent measures of annotation and annotator impact,"James Lanagan, Alan F. Smeaton",Proceedings of the WSDM'09 Workshop on Exploiting Semantic Annotations in …,5,2009
Alan F. Smeaton,TennisSense: a multi-sensory approach to performance analysis in tennis,"Luke Conroy, Ciarán O’Conaire, Shirley Coyle, Graham Healy, Philip Kelly, Damien Connaghan, Noel O’Connor, Alan F. Smeaton, Brian Caulfield, Paddy Nixon",,6,2009
Alan F. Smeaton,Context-aware person identification in personal photo collections,"Neil O’Hare, Alan F. Smeaton",IEEE Transactions on Multimedia 11 (2) 220-228,90,2009
Alan F. Smeaton,Data collection methods for analyzing task-based information access in molecular medicine,"Sanna Kumpulainen, Kalervo Järvelin, Sami Serola, Aiden Doherty, Daragh Byrne, Alan F. Smeaton, Gareth Jones",The First International Workshop on Mobilizing Health Information to Support …,15,2009
Alan F. Smeaton,Utilising wearable sensor technology to provide effective memory cues,"Aiden Doherty, Alan F. Smeaton",ERCIM News 48-49,2,2009
Alan F. Smeaton,"Advances in Multimedia Modeling: 15th International Multimedia Modeling Conference, MMM 2009, Sophia-Antipolis, France, January 7-9, 2009. Proceedings.","Benoit Huet, Alan F. Smeaton, Ketan Mayer-Patel, Yannis Avrithis",Springer,0,2009
Alan F. Smeaton,Proceedings of the 15th International Multimedia Modeling Conference on Advances in Multimedia Modeling,"Benoit Huet, Alan F. Smeaton, Ketan Mayer-Patel, Yannis Avrithis",Springer-Verlag,0,2009
Alan F. Smeaton,Are visual informatics actually useful in practice: A study in a film studies context,"Nazlena Mohamad Ali, Alan F. Smeaton",1st International Visual Informatics Conference IVIC 2009,8,2009
Alan F. Smeaton,Curiosity Cloning: Neural Analysis of Scientific Knowledge,"Dario Izzo, Luca Rossini, Marek Rucinski, Christos Ampatzis, Graham Healy, Peter Wilkins, Alan F. Smeaton, Ashkan Yazdani, Touradj Ebrahimi",Proceedings of the International Joint Conference on Artificial Intelligence …,6,2009
Alan F. Smeaton,"Developing, Deploying and Assessing Usage of a Movie Archive System among Students of Film Studies","Nazlena Mohamad Ali, Alan F. Smeaton, Hyowon Lee, Patrick Brereton",Human-Computer Interaction. Interacting in Various Application Domains: 13th …,8,2009
Alan F. Smeaton,Query Optimisation for Data Mining in Peer-to-Peer Sensor Networks,"Mark Roantree, Alan F. Smeaton, Noel O’Connor, V Andrieu, N. Legeay, Fabrice Camous",Intelligent Techniques for Warehousing and Mining Sensor Network Data 234–256,0,2009
Alan F. Smeaton,Utilising the simplicity of touch to enable older people review their SenseCam images independently,"Niamh Caprani, Aiden Doherty, Hyowon Lee, Alan F. Smeaton, Noel O’Connor",,0,2009
Alan F. Smeaton,RATB Multi-Modal Sensor Network,"Edel O’Connor, Alan F. Smeaton, Noel O’Connor, Dermot Diamond",In: Environ 2010 17-19 February 2010 Limerick Ireland. 17-19,0,2009
Alan F. Smeaton,Biometric responses to music-rich segments in films: The cdvplex,"Alan F. Smeaton, Sandra Rothwell",2009 Seventh International Workshop on Content-Based Multimedia Indexing …,27,2009
Alan F. Smeaton,Combining relevance information in a synchronous collaborative information retrieval environment,"Colum Foley, Alan F. Smeaton, Gareth Jones",Collaborative and Social Information Retrieval and Access: Techniques for …,3,2009
Alan F. Smeaton,Tennissense: A multi-modal sensing platform for sport,"Noel O’Connor, Philip Kelly, Ciarán O’Conaire, Damien Connaghan, Alan F. Smeaton, Brian Caulfield, Dermot Diamond, N Moyna",EICIM News Special Edition on the Sensor Web 1 1,4,2009
Alan F. Smeaton,Exploring the use of paragraph-level annotations for sentiment analysis of financial blogs,"Paul Ferguson, Neil O’Hare, Michael Davy, Adam Bermingham, Paraic Sheridan, Cathal Gurrin, Alan F. Smeaton",WOMAS 2009 - Workshop on Opinion Mining and Sentiment Analysis 13 November …,35,2009
Alan F. Smeaton,A sensing platform for physiological and contextual feedback to tennis athletes,"Damien Connaghan, Sarah Hughes, Gregory May, Philip Kelly, Ciarán O’Conaire, Noel O’Connor, Donal O’Gorman, Alan F. Smeaton, Niall Moyna",2009 Sixth International Workshop on Wearable and Implantable Body Sensor …,30,2009
Alan F. Smeaton,Robust pedestrian detection and tracking in crowded scenes,"Philip Kelly, Noel O’Connor, Alan F. Smeaton",Image and Vision Computing 27 (10) 1445-1458,38,2009
Alan F. Smeaton,Interaction platform-orientated perspective in designing novel applications,"Hyowon Lee, Alan F. Smeaton",British Computer Society; The Ergonomics Society;,5,2009
Alan F. Smeaton,Environmental monitoring of Galway Bay: Fusing data from remote and in-situ sources,"Edel O’Connor, Jer Hayes, Alan F. Smeaton, Noel O’Connor, Dermot Diamond",Remote Sensing for Environmental Monitoring GIS Applications and Geology …,8,2009
Alan F. Smeaton,Enhancing the functionality of interactive TV with content-based multimedia analysis,"Paul Ferguson, Cathal Gurrin, Hyowon Lee, Sorin Sav, Alan F. Smeaton, Noel O’Connor, Yoonhee Choi, Hee-Seon Park",2009 11th IEEE International Symposium on Multimedia 495-500,10,2009
Alan F. Smeaton,Short-term rainfall nowcasting: using rainfall radar imaging,"Peng Wang, Alan F. Smeaton, Lao Songyang, Edel O’Connor, Yunxiang Ling, Noel O’Connor",,15,2009
Alan F. Smeaton,Shape matching method for indexing and retrieving multimedia data,"Thomas Adamek, Noel O’Connor, Sean Marlow, Noel Murphy, Alan F. Smeaton",US Patent 7620250,18,2009
Alan F. Smeaton,Shape matching method for indexing and retrieving multimedia data,"Thomas Adamek, Noel O’Connor, Sean Marlow, Noel Murphy, Alan F. Smeaton",US Patent 7620250,18,2009
Alan F. Smeaton,Topic-dependent sentiment analysis of financial blogs,"Neil O’Hare, Michael Davy, Adam Bermingham, Paul Ferguson, Paraic Sheridan, Cathal Gurrin, Alan F. Smeaton",Proceedings of the 1st international CIKM workshop on Topic-sentiment …,119,2009
Alan F. Smeaton,The application of multi-modal sensor networks to the monitoring of coastal and inland marine environments,"Edel O’Connor, Jer Hayes, Alan F. Smeaton, Noel O’Connor, Dermot Diamond",,0,2009
Alan F. Smeaton,Utilising contextual memory retrieval cues and the ubiquity of the cell phone to review lifelogged physiological activities,"Aiden Doherty, Kristin M Tolle, Alan F. Smeaton",Proceedings of the 1st international workshop on Interactive multimedia for …,6,2009
Alan F. Smeaton,An outdoor spatially-aware audio playback platform exemplified by a virtual zoo,"Graham Healy, Alan F. Smeaton",Proceedings of the 17th ACM international conference on Multimedia 837-840,2,2009
Alan F. Smeaton,An investigation into event decay from large personal media archives,"Aiden Doherty, Cathal Gurrin, Alan F. Smeaton",Proceedings of the 1st ACM international workshop on Events in multimedia 49-56,11,2009
Alan F. Smeaton,Creating a web-scale video collection for research,"Paul Over, George Awad, Alan F. Smeaton, Colum Foley, James Lanagan",Proceedings of the 1st workshop on Web-scale multimedia corpus 25-32,9,2009
Alan F. Smeaton,Neurological modeling of what experts vs. non-experts find interesting,"Alan F. Smeaton, Peter Wilkins, Graham Healy, Christos Ampatzis, Marek Rucinski, Dario Izzo",,0,2009
Alan F. Smeaton,"Managing millions of SenseCam images, events are key",Alan F. Smeaton,,0,2009
Alan F. Smeaton,Three years of SenseCam images-observations on cued recall,"Aiden Doherty, Katalin Pauly-Takacs, Cathal Gurrin, Chris Moulin, Alan F. Smeaton",,7,2009
Alan F. Smeaton,Using association rule mining to enrich semantic concepts for video retrieval,"Nastaran Fatemi, Florian Poulin, Laura E Raileany, Alan F. Smeaton",,5,2009
Alan F. Smeaton,基于感知概念和有限状态机的体育视频语义内容分析模型,老松杨， 白亮， 刘海涛,小型微型计算机系统 1137-1141,1,2009
Alan F. Smeaton,Pump less wearable microfluidic device for real time pH sweat monitoring,"Fernando Benito-Lopez, Shirley Coyle, Robert Byrne, Alan F. Smeaton, Noel O’Connor, Dermot Diamond",Procedia Chemistry 1 (1) 1103-1106,41,2009
Alan F. Smeaton,The smart sweatband,"Fernando Benito-Lopez, Shirley Coyle, Robert Byrne, Alan F. Smeaton, Noel O’Connor, Dermot Diamond",,0,2009
Alan F. Smeaton,River water-level estimation using visual sensing,"Edel O’Connor, Ciarán O’Conaire, Alan F. Smeaton, Noel O’Connor, Dermot Diamond",,6,2009
Alan F. Smeaton,Measuring the influence of concept detection on video retrieval,"Pablo Toharia, Oscar D Robles, Alan F. Smeaton, Ángel Rodríguez",International Conference on Computer Analysis of Images and Patterns 581-589,8,2009
Alan F. Smeaton,Automated murmurs: The social mobile tourist application,"Jill Freyne, Adam J Brennan, Barry Smyth, Daragh Byrne, Alan F. Smeaton, Gareth Jones",2009 International Conference on Computational Science and Engineering 4 …,15,2009
Alan F. Smeaton,Evaluation of coordination techniques in synchronous collaborative information retrieval,"Colum Foley, Alan F. Smeaton",arXiv preprint arXiv:0908.0912,14,2009
Alan F. Smeaton,Evaluation of coordination techniques in synchronous collaborative information retrieval,"Colum Foley, Alan F. Smeaton",arXiv preprint arXiv:0908.0912,14,2009
Alan F. Smeaton,Combining social network analysis and sentiment analysis to explore the potential for online radicalisation,"Adam Bermingham, Maura Conway, Lisa Mcinerney, Neil O’Hare, Alan F. Smeaton",2009 International Conference on Advances in Social Network Analysis and …,183,2009
Alan F. Smeaton,"Developing, deploying and assessing usage of a movie archive system among students of film studies","Nazlena Mohamad Ali, Alan F. Smeaton, Hyowon Lee, Patrick Brereton",International Conference on Human-Computer Interaction 567-576,8,2009
Alan F. Smeaton,A study of inter-annotator agreement for opinion retrieval,"Adam Bermingham, Alan F. Smeaton",Proceedings of the 32nd international ACM SIGIR conference on Research and …,32,2009
Alan F. Smeaton,DCU collaborative video search system,"Colum Foley, Peter Wilkins, Alan F. Smeaton",Proceedings of the ACM International Conference on Image and Video Retrieval 52,1,2009
Alan F. Smeaton,DCU collaborative video search system,"Colum Foley, Peter Wilkins, Alan F. Smeaton",Proceedings of the ACM International Conference on Image and Video Retrieval 52,1,2009
Alan F. Smeaton,User variance and its impact on video retrieval benchmarking,"Peter Wilkins, Raphaël Troncy, Martin Halvey, Daragh Byrne, Alia Amin, P Punitha, Alan F. Smeaton, Robert Villa",Proceedings of the ACM International Conference on Image and Video Retrieval …,14,2009
Alan F. Smeaton,Are visual informatics actually useful in practice: a study in a film studies context,"Nazlena Mohamad Ali, Alan F. Smeaton",Visual Informatics: Bridging Research and Practice 811-821,8,2009
