Research name,Publication Title,Author List,Conf/Journal Details,Citation count,Year
Jagadeeswaran Thangaraj,A Comparative Study on Transformation of UML/OCL to Other Specifications,"Jagadeeswaran Thangaraj, Senthilkumaran Ulaganathan",Recent Advances in Computer Science and Communications (Formerly: Recent …,0,2020
Jagadeeswaran Thangaraj,Defining Theoretical Foundations to Unified Metamodel For Model Reusability,"Jagadeeswaran Thangaraj, Senthilkumaran Ulaganathan",Recent Advances in Computer Science and Communications 13 (4) 620 - 626,0,2020
Jagadeeswaran Thangaraj,Model reusability and multidirectional transformation using unified metamodel,"Jagadeeswaran Thangaraj, Senthilkumaran Ulaganathan",2018 IEEE Distributed Computing VLSI Electrical Circuits and Robotics …,1,2018
Jagadeeswaran Thangaraj,A Formal Framework to Unified Metamodel for Consistent Transformation,"Jagadeeswaran Thangaraj, Senthilkumaran Ulaganathan",PhD Symposium at iFM’18 on Formal Methods: Algorithms Tools and …,0,2018
Jagadeeswaran Thangaraj,Mapping USE Specifications into Spec#,"Jagadeeswaran Thangaraj, Senthilkumaran Ulaganathan",Lecture Notes in Computer Science 10748 (978-3-319-74730-9) 331--339,0,2018
Jagadeeswaran Thangaraj,Introducing Ownership Types to Specification Design,"Jagadeeswaran Thangaraj, Senthilkumaran Ulaganathan",International Journal of Scientific & Engineering Research 8 (8) 843 - 848,0,2017
Jagadeeswaran Thangaraj,Introducing Ownership Type Constraints to UML/OCL,"Jagadeeswaran Thangaraj, Senthilkumaran Ulaganathan",International Workshop on Aliasing Capabilities and Ownership IWACO17 co …,0,2017
Jagadeeswaran Thangaraj,Adding Ownership Constraints to OCL to automatically generate Spec# skeletons,Jagadeeswaran Thangaraj,Maynooth University Ireland,0,2015
