Research name,Publication Title,Author List,Conf/Journal Details,Citation count,Year
Murat YILMAZ,Auction-based serious game for bug tracking,"Çağdaş Üsfekes, Eray Tuzun, Murat Yilmaz, Yagup Macit, Paul M. Clarke",IET Software 13 (5) 386-392,1,2019
Murat YILMAZ,Guest Editorial: Gamification and Persuasive Games for Software Engineering,"Murat Yilmaz, Rory O’Connor, Ricardo Colomo Palacios, Paul M. Clarke",IET SOFTWARE 13 (2) 97-98,0,2019
Murat YILMAZ,Anti-Social: Bireylerin Sosyal Medya Bağımlılığını Azaltmak Amacıyla Düşünülmüş Bir Ciddi Oyun,"Ulaş Güleç, Murat Yilmaz, Can Koral Adalı, Veysi İşler",13. Ulusal Yazılım Mühendisliği Sempozyumu (UYMS 2019),0,2019
Murat YILMAZ,Integration of accessibility design patterns with the software implementation process of ISO/IEC 29110,"Sandra Sanchez‐Gordon, Mary Sánchez‐Gordón, Murat Yilmaz, Rory O’Connor",Journal of Software: Evolution and Process 31 (1) e1987,6,2019
Murat YILMAZ,Observed Effects of Software Processes Change in Three Software Firms: Industrial Exploratory Case Study,Murat Yilmaz,Pamukkale Üniversitesi Mühendislik Bilimleri Dergisi 25 (2) 240-246,2,2019
Murat YILMAZ,CENGO: A Web-Based Serious Game to Increase the Programming Knowledge Levels of Computer Engineering Students,"Ulas Gulec, Murat Yilmaz, Alihan Dogus Yalcin, Rory O’Connor, Paul M. Clarke",European Conference on Software Process Improvement 1060 237--248,2,2019
Murat YILMAZ,Yazılım Uzmanları için Tasarlanmış Dijital Olmayan İş Birliği Oyunu,"Hazal Ipek Kahraman, Yasemin Bekturk, Irmak Angun, Yasemin Yigit Kuru, Murat Yilmaz",13. Ulusal Yazılım Mühendisliği Sempozyumu (UYMS 2019),0,2019
Murat YILMAZ,Assessing Personality Traits in a Large Scale Software Development Company: Exploratory Industrial Case Study,"Zulal Akarsu, Pinar Orgun, Gunyel Bora Dinc Hakan, Murat Yilmaz",Systems Software and Services Process Improvement: 26th European Conference …,1,2019
Murat YILMAZ,A 3D virtual environment for training soccer referees,"Ulas Gulec, Murat Yilmaz, Veysi Isler, Rory O’Connor, Paul M. Clarke",Computer Standards & Interfaces 64 1-10,8,2019
Murat YILMAZ,Software Testing: A Changing Career,"Sean Cunningham, Jemil Gambo, Aidan Lawless, Declan Moore, Murat Yilmaz, Paul M. Clarke, Rory O’Connor",European Conference on Software Process Improvement 731-742,2,2019
Murat YILMAZ,Cengo: A web-based serious game to increase the programming knowledge levels of computer engineering students,"Ulas Gulec, Murat Yilmaz, Alihan Dogus Yalcin, Rory O’Connor, Paul M. Clarke",European Conference on Software Process Improvement 237-248,2,2019
Murat YILMAZ,Assessing personality traits in a large scale software development company: exploratory industrial case study,"Zulal Akarsu, Pinar Orgun, Hakan Dinc, Bora Gunyel, Murat Yilmaz",European Conference on Software Process Improvement 192-206,1,2019
Murat YILMAZ,The Changing Role of the Software Engineer,"Edward Meade, Emma O’Keeffe, Niall Lyons, Dean Lynch, Murat Yilmaz, Ulas Gulec, Rory O’Connor, Paul M. Clarke",European Conference on Software Process Improvement 682-694,1,2019
Murat YILMAZ,Applying Blockchain to Improve the Integrity of the Software Development Process,"Murat Yilmaz, Serdar Tasel, Eray Tuzun, Ulas Gulec, Rory O’Connor, Paul M. Clarke",European Conference on Software Process Improvement 260-271,2,2019
Murat YILMAZ,Yazılım Mühendisliği Dersi için Geliştirilmiş Ders Akış Modeli ve İlgili Vaka Çalışması,"Murat Yilmaz, Ulas Gulec",12th Turkish National Software Engineering Conference (UYMS 2018) 1-11,0,2018
Murat YILMAZ,Virtual Reality-Based Daily Scrum Meetings.,Murat Yilmaz,Encyclopedia of Computer Graphics and Games 1--6,2,2018
Murat YILMAZ,An Exploratory Study to Assess Digital Map Zoom/Pan/Rotate Methods with HoloLens,"İsmail Kılınç, Murat Yilmaz",Süleyman Demirel Üniversitesi Fen Bilimleri Enstitüsü Dergisi 22 (2) 458-463,0,2018
Murat YILMAZ,An interactive 3D virtual environment to reduce the public speaking anxiety levels of novice software engineers,"Merve Denizci Nazligul, Murat Yilmaz, Ulas Gulec, Adviye Esin Yılmaz, Veysi Isler, Rory O’Connor, Ma Gozcu, Paul M. Clarke",IET Software 13 (2) 152-158,7,2018
Murat YILMAZ,Using Adapted Version of Hoshin Matrix for Selection of Agile Software Development Processes,"Zulal Akarsu, Ozgun Onat Metin, Yasemin Yigit Kuru, Murat Yilmaz",12th Turkish National Software Engineering Conference (UYMS 2018),1,2018
Murat YILMAZ,Software Development Overall Efficiency Improvement in a CMMI Level 5 Organization within the scope of a Case Study,"Pınar Örgün, Deniz Gungor, Yasemin Yigit Kuru, Ozgun Onat Metin, Murat Yilmaz",Uluslararası Bilgisayar Bilimleri ve Mühendisliği Konferansı (UBMK 2018) 1-12,3,2018
Murat YILMAZ,Artırılmış Gerçeklik Tabanlı Sürekli İşe Alıştırma Sistemi (Augmented Reality Based Continuous Onboarding Framework),"Eray Ohri, Ipek And Oge, Irem And Orkun, Bora And Yilmaz, Murat And Tuzun",12th Turkish National Software Engineering Conference (UYMS 2018) 1-11,0,2018
Murat YILMAZ,Yazılım Geliştirme Süreçlerini Eğitmek Amacıyla Tasarlanan Sanal Ofis Ortamında Ortamın Gerçekçiliğini Arttıran Etmenler,"Ulas Gulec, Murat Yilmaz, Veysi Isler",12th Turkish National Software Engineering Conference (UYMS 2018) 1-11,0,2018
Murat YILMAZ,In search of the origins and enduring impact of agile software development,"Paul M. Clarke, Rory O’Connor, Murat Yilmaz",Proceedings of the 2018 International Conference on Software and System …,15,2018
Murat YILMAZ,Simulacrum: Savas Kosullarinda Acil Tibbi Mudahale ve Ilk Yardim Simulasyonu,"M.A. Gulec,Ulas And Gozcu, Sedanur Dogan, Nesil Mesurhan, Murat Yilmaz, Veysi Isler, Mustafa Dinc",12th Turkish National Software Engineering Conference (UYMS 2018) 1-11,0,2018
Murat YILMAZ,Serious game plug-in experience for devops,"Çağdaş Üsfekes, Yagup Macit, Murat Yilmaz, Eray Tuzun",CEUR Workshop Proceedings 2201,0,2018
Murat YILMAZ,An ISO/IEC 12207 perspective on software development process adaptation,"Gerard Marks, Rory O’Connor, Murat Yilmaz, Paul M. Clarke",Software Quality Professional 20 (2) 48-58,2,2018
Murat YILMAZ,Adopting virtual reality as a medium for software development process education,"Ulas Gulec, Murat Yilmaz, Veysi Isler, Rory O’Connor, Paul M. Clarke",Proceedings of the 2018 International Conference on Software and System …,1,2018
Murat YILMAZ,The Impact of Situational Context on Software Process: A Case Study of a Very Small-Sized Company in the Online Advertising Domain,"Görkem Giray, Murat Yilmaz, Rory O’Connor, Paul M. Clarke",25th European Conference on Software Process Improvement (EuroSPI 2018) 896 …,8,2018
Murat YILMAZ,Towards a Role Playing Game for Exploring the Roles in Scrum to Improve Collaboration Problems,"Zulal Akarsu, Özgün Onat Metin, Deniz Gungor, Murat Yilmaz",25th European Conference on Software Process Improvement (EuroSPI 2018) 896 …,2,2018
Murat YILMAZ,Adopting Augmented Reality for the Purpose of Software Development Process Training and Improvement: An Exploration,"İpek Ohri, İrem Öge, Bora Orkun, Murat Yilmaz, Eray Tuzun, Paul M. Clarke, Rory O’Connor",25th European Conference on Software Process Improvement (EuroSPI 2018) 896 …,0,2018
Murat YILMAZ,Towards a process management life-cycle model for graduation projects in computer engineering,"Murat Yilmaz, Faris Serdar Tasel, Ulas Gulec, Ugur Sopaoglu",PloS one 13 (11) e0208012,2,2018
Murat YILMAZ,The Design Process of a Board Game for Exploring the Territories of the United States,"Mehmet Kosa, Murat Yilmaz",Press Start 4 (1) 36-52,5,2017
Murat YILMAZ,An Exploratory Study to Assess Analytical and Logical Thinking Skills of the Software Practitioners using a Gamification Perspective,"Şahin Kayalı, Murat Yilmaz",Süleyman Demirel Üniversitesi Fen Bilimleri Enstitüsü Dergisi 21 (1) 178-189,6,2017
Murat YILMAZ,Software Process Improvement and Capability Determination Conference 2016,"Paul M. Clarke, Murat Yilmaz",Computer Standards & Interfaces 54 117-118,1,2017
Murat YILMAZ,A Literature Survey: Is it Necessary to Develop a New Software Development Methodology for Virtual Reality Projects?,"Ulas Gulec, Murat Yilmaz, Veysi Isler",Journal of Universal Computer Science 23 (8) 725-754,7,2017
Murat YILMAZ,An industrial case study to improve the onboaring process in software management (Yazılım Yönetiminde İşe Alıştırma Süreçlerinin İyileştirilmesi İçin Düşünülmüş Bir Endüstriyel …,"Murat Yilmaz, Ulas Gulec, Rory O’Connor, Paul M. Clarke, Eray Tuzun",11th Turkish National Software Engineering Symposium (UYMS 2017),1,2017
Murat YILMAZ,An examination of personality traits and how they impact on software development teams,"Murat Yilmaz, Rory O’Connor, Ricardo Colomo Palacios, Paul M. Clarke",Information and Software Technology 86 101-122,51,2017
Murat YILMAZ,Uygulama Yaşam Döngüsü Yönetim Araçlarının Verimini Arttırmak İçin Ciddi Oyun Uygulaması.,"Çağdaş Üsfekes, Murat Yilmaz, Eray Tuzun",11th Turkish National Software Engineering Symposium (UYMS 2017) 1-11,0,2017
Murat YILMAZ,Exploring software process variation arising from differences in situational context,"Ryan Treanor, Rory O’Connor, David Solan, Peter Elger, Murat Yilmaz, Adam Ennis, Mark Gerrity, Sean Mcgrath",European Conference on Software Process Improvement 748 29-42,12,2017
Murat YILMAZ,Examining Reward Mechanisms for Effective Usage of Application Lifecycle Management Tools,"Çağdaş Üsfekes, Murat Yilmaz, Eray Tuzun, Paul M. Clarke, Rory O’Connor",European Conference on Software Process Improvement (EUROSPI 2017) 748 259-268,8,2017
Murat YILMAZ,Overcoming Public Speaking Anxiety of Software Engineers Using Virtual Reality Exposure Therapy,"Merve Denizci Nazligul, Murat Yilmaz, Ulas Gulec, Mert Ali Gozcu, Rory O’Connor, Paul M. Clarke",European Conference on Software Process Improvement (EUROSPI 2017) 748 191-202,15,2017
Murat YILMAZ,A systematic investigation into the use of game elements in the context of software business landscapes: A systematic literature review,"Serhan Olgun, Murat Yilmaz, Paul M. Clarke, Rory O’Connor",International Conference on Software Process Improvement and Capability …,8,2017
Murat YILMAZ,Teaching ISO/IEC 12207 software lifecycle processes: A serious game approach,"Ufuk Aydan, Murat Yilmaz, Paul M. Clarke, Rory O’Connor",Computer Standards & Interfaces 54 129-138,24,2017
Murat YILMAZ,Software Process Improvement and Capability Determination Conference 2016,"Paul M. Clarke, Murat Yilmaz",Elsevier Computer Standards & Interfaces 54 (3) 117-118,1,2017
Murat YILMAZ,A Scrumban integrated gamification approach to guide software process improvement: a Turkish case study,"Murat Yilmaz, Rory O’Connor",Tehnicki Vjesnik (Technical Gazette) 23 (1) 237-245,53,2016
Murat YILMAZ,"Improving Social Aspects of the Software Development Process: Games, Gamification and Related Approaches J. UCS Special Issue","Murat Yilmaz, Rory O’Connor, Manuel Mora",Journal of Universal Computer Science 22 (12) 1487-1488,2,2016
Murat YILMAZ,Bilgisayar Mühendisliği Bitirme Projeleri için Düşünülmüş Bir Süreç Yönetim Modeli,"Murat Yilmaz, Serdar Taşel, Ulaş Güleç, Uğur Sopaoğlu",Proceedings of the 10th Turkish National Software Engineering Symposium,0,2016
Murat YILMAZ,Effective social productivity measurements during software development—an empirical study,"Murat Yilmaz, Rory O’Connor, Paul M. Clarke",International Journal of Software Engineering and Knowledge Engineering 26 …,17,2016
Murat YILMAZ,A serious game for improving the decision making skills and knowledge levels of Turkish football referees according to the laws of the game,"Ulas Gulec, Murat Yilmaz",SpringerPlus 5 (1) 1,11,2016
Murat YILMAZ,A gamification approach to improve the software development process by exploring the personality of software practitioners,"Murat Yilmaz, Murat Yilmaz, Rory O’Connor, Paul M. Clarke",International Conference on Software Process Improvement and Capability …,23,2016
Murat YILMAZ,An investigation of software development process terminology,"Paul M. Clarke, Antoni Lluís Mesquida Calafat, Damjan Ekert, J.J. Ekstrom, Tatjana Gornostaja, Milo Jovanovic, Jørn Johansen, Antonia Mas, Richard Messnarz, Blanca Najera Villar, Alexander O’Connor, Rory O’Connor, Michael Reiner, Gabriele Sauberer, Klaus-Dirk Schmitz, Murat Yilmaz",International Conference on Software Process Improvement and Capability …,25,2016
Murat YILMAZ,Gamifying the Onboarding Process for Novice Software Practitioners,"Mehmet Kosa, Murat Yilmaz",European Conference on Software Process Improvement 633 242-248,2,2016
Murat YILMAZ,Software Developer’s Journey,"Murat Yilmaz, Berke Atasoy, Rory O’Connor, Jean-Bernard Martens, Paul M. Clarke",European Conference on Software Process Improvement (EuroSPI 2016) 633 203-211,6,2016
Murat YILMAZ,Refactoring software development process terminology through the use of ontology,"Paul M. Clarke, Antoni Lluís Mesquida Calafat, Damjan Ekert, J.J. Ekstrom, Tatjana Gornostaja, Milo Jovanovic, Jørn Johansen, Antonia Mas, Richard Messnarz, Blanca Najera Villar, Alexander O’Connor, Rory O’Connor, Michael Reiner, Gabriele Sauberer, Klaus-Dirk Schmitz, Murat Yilmaz",European Conference on Software Process Improvement (EuroSPI 2016) 633 47-57,12,2016
Murat YILMAZ,Software engineering education and games: a systematic literature review,"Mehmet Kosa, Murat Yilmaz, Rory O’Connor, Paul M. Clarke",Journal of Universal Computer Science 22 (12) 1558-1574,50,2016
Murat YILMAZ,Futbol Hakemlerinin Karar Verme Yeteneklerini Geliştirmek İçin Düşünülmüş Ciddi Oyun Tabanlı Öğrenme Çatısı.,"Ulaş Güleç, Murat Yilmaz",Ulusal Yazılım Mühendisliği Konferansı (UYMS 2015),0,2015
Murat YILMAZ,Understanding personality differences in software organizations using Keirsey Temperament Sorter,"Murat Yilmaz, Rory O’Connor",IET Software 9 (5) 129-134,4,2015
Murat YILMAZ,Exploring the belief systems of software development professionals,"Rory O’Connor, Murat Yilmaz",Cybernetics and Systems: An International Journal 46 (6-7) 528-542,4,2015
Murat YILMAZ,Kitlesel Açık Çevrimiçi Kurslardaki Katılımcı Profillerinin Yapay Sinir Ağı Kullanılarak Sınıflandırılması.,"Ali Al-Taei, Murat Yilmaz, Rory O’Connor, Ugur Halici",9th Turkish National Software Engineering Conference (UYMS 2015),0,2015
Murat YILMAZ,Software development roles: a multi-project empirical investigation,"Murat Yilmaz, Rory O’Connor, Paul M. Clarke",ACM SIGSOFT Software Engineering Notes 40 (1) 1-5,16,2015
Murat YILMAZ,Towards a serious game to teach ISO/IEC 12207 software lifecycle process: an interactive learning approach,"Ufuk Aydan, Murat Yilmaz, Rory O’Connor",International Conference on Software Process Improvement and Capability …,17,2015
Murat YILMAZ,Exploring the relationship between software process adaptive capability and organisational performance,"Paul M. Clarke, Rory O’Connor, Brian Leavy, Murat Yilmaz",IEEE Transactions on Software Engineering 41 (12) 1169-1183,46,2015
Murat YILMAZ,Designing games for improving the software development process,"Mehmet Kosa, Murat Yilmaz",European Conference on Software Process Improvement (EUROSPI 2015) 543 303-310,8,2015
Murat YILMAZ,A machine-based personality oriented team recommender for software development organizations,"Murat Yilmaz, Ali Al-Taei, Rory O’Connor",European Conference on Software Process Improvement (EUROSPI 2015) 543 75-86,6,2015
Murat YILMAZ,"Systems, Software and Services Process Improvement: 22nd European Conference, EuroSPI 2015, Ankara, Turkey, September 30--October 2, 2015. Proceedings","Rory O’Connor, Mariye Umay Akkaya, Kerem Kemaneci, Murat Yilmaz, Alexander Poth, Richard Messnarz",Springer,2,2015
Murat YILMAZ,Kitlesel Açık Çevrimiçi Kurslardaki Katılımcı Profillerinin Yapay Sinir Agı Kullanılarak Sınıflandırılması (Classification of Participants Profiles in MOOCs Using Neural …,"Ali Al-Taei, Murat Yilmaz, Rory O’Connor, Ugur Halici",9th Turkish National Software Engineering Conference (UYMS 2015) 1-12,0,2015
Murat YILMAZ,Towards a quest-based contextualization process for game-based learning,"Murat Yilmaz, Murat Saran, Rory O’Connor",8th European Conference on Games Based Learning (ECGBL2014) 2,2,2014
Murat YILMAZ,Investigating the factors affecting software development productivity by using exploratory factor analysis [in Turkish-Yazılım Geliştirme Üretkenliğini Etkileyen Faktörlerin …,"Murat Yilmaz, Rory O’Connor, Abdul Kadir GöRüR",,0,2014
Murat YILMAZ,An exploration of individual personality types in software development,"Murat Yilmaz, Rory O’Connor, Paul M. Clarke",European Conference on Software Process Improvement 111-122,8,2014
Murat YILMAZ,Gamification as a Disruptive Factor in Software Process Improvement Initiatives.,"Eduardo Herranz, Ricardo Colomo Palacios, Antonio De Amescua Seco, Murat Yilmaz",J. UCS 20 (6) 885-906,56,2014
Murat YILMAZ,Yazılım Geliştiren Organizasyonlar için Düşünülmüş Bir Kişilik Tipi Ölçüm Oyunu.,"Murat Yilmaz, Rory O’Connor",7th Turkish National Software Engineering Conference (UYMS 2013),1,2013
Murat YILMAZ,A software process engineering approach to understanding software productivity and team personality characteristics: an empirical investigation,Murat Yilmaz,Dublin City University,34,2013
Murat YILMAZ,A systematic approach to the comparison of roles in the software development processes,"Murat Yilmaz, Rory O’Connor, Paul M. Clarke",International Conference on Software Process Improvement and Capability …,25,2012
Murat YILMAZ,Social capital as a determinant factor of software development productivity: An empirical study using structural equation modeling,"Murat Yilmaz, Rory O’Connor",International Journal of Human Capital and Information Technology …,12,2012
Murat YILMAZ,Towards the understanding and classification of the personality traits of software development practitioners: Situational context cards approach,"Murat Yilmaz, Rory O’Connor",2012 38th Euromicro Conference on Software Engineering and Advanced …,23,2012
Murat YILMAZ,A hierarchy of SPI activities for software SMEs: results from ISO/IEC 12207-based SPI assessments,"Paul M. Clarke, Rory O’Connor, Murat Yilmaz",International Conference on Software Process Improvement and Capability …,15,2012
Murat YILMAZ,A market based approach for resolving resource constrained task allocation problems in a software development process,"Murat Yilmaz, Rory O’Connor",European Conference on Software Process Improvement 25-36,12,2012
Murat YILMAZ,A software process engineering approach to improving software team productivity using socioeconomic mechanism design,"Murat Yilmaz, Rory O’Connor",ACM SIGSOFT Software Engineering Notes 36 (5) 1-5,11,2011
Murat YILMAZ,An empirical investigation into social productivity of a software process: An approach by using the structural equation modeling,"Murat Yilmaz, Rory O’Connor",European Conference on Software Process Improvement (EUROSPI 2011) 172 155-166,14,2011
Murat YILMAZ,Oyun Kuramı Kullanarak Yazılım Takımlarının Üretkenliğini Artırmak İçin Geliştirilen Bir Yazılım Süreç Mühendisliği Yaklaşımı,"Murat Yilmaz, Rory O’Connor",5th Turkish National Software Engineering Symposium (UYMS 2011),5,2011
Murat YILMAZ,An approach for improving the social aspects of the software development process by using a game theoretic perspective: towards a theory of social productivity of software …,"Murat Yilmaz, Rory O’Connor",6th International Conference on Software and Data Technologies,3,2011
Murat YILMAZ,Improving software development process through economic mechanism design,"Murat Yilmaz, Rory O’Connor, John Collins",European Conference on Software Process Improvement (EUROSPI 2010) 99 177-188,21,2010
Murat YILMAZ,Maximizing the value of the software development process by game theoretic analysis,"Murat Yilmaz, Rory O’Connor",Proceedings of the 11th International Conference on Product Focused Software …,10,2010
