Research name,Publication Title,Author List,Conf/Journal Details,Year,ISBN,ISSN,Item Type,Event Type,Refereed,Date of Award,Supervisor(s),Uncontrolled Keywords,Subject,DCU Faculties and Centres,Use License,ID Code,Deposited On,Published in,Publisher,Official URL,Copyright Information,Funders,Additional Information,Tweets,Mendeley Readers
Malika Bendechache,Analysing dependability and performance of a real-world Elastic Search application.,"Bendechache, Malika, Silva, Ivanovitch, Leoni Santos, Guto, Guedes, Luiz Affonso, Svorobej, Sergej, Noya Mario, Manuel, Ares, M. Eduardo, Byrne, James, Takako Endo, Patricia, Lynn, Theo","9th Latin-American Symposium on Dependable Computing (LADC), 19-21 Nov. 2019, Natal, Brazil..",2019,,,Conference or Workshop Item (Paper),Conference,Yes,,,,Computer Science > Computational complexity. Computer Science > Computer simulation. ,DCU Faculties and Schools > DCU Business School. DCU Faculties and Schools > Faculty of Engineering and Computing > School of Computing. ,,24594,10 Jun 2020 15:27 by  Malika Bendechache. Last Modified 10 Jun 2020 15:29,"2019 9th Latin-American Symposium on Dependable Computing (LADC), Proceedings..  IEEE.",IEEE,http://dx.doi.org/10.1109/LADC48089.2019.8995709,© 2019 IEEE,"European Unions Horizon 2020 Research and Innovation Programme under Grant Agreement Number 732667., World Technology Universities Network (WTUN), Irish Institute of Digital Business (dotLAB)",,,
Malika Bendechache,Hierarchical aggregation approach for distributed clustering of spatial datasets.,"Bendechache, Malika, Le-Khac, Nhien-An, Kechadi, M-Tahar","2016 IEEE 16th International Conference on Data Mining Workshops (ICDMW), 12-15 Dec 2016, Barcelona, Spain.",2017,,,Conference or Workshop Item (Paper),Conference,Yes,,,Big Data; spatial data; clustering; distributed mining; data analysis; k-means; DBSCAN; balance vector,Computer Science > Algorithms. Computer Science > Machine learning. ,DCU Faculties and Schools > Faculty of Engineering and Computing > School of Computing. Research Initiatives and Centres > INSIGHT Centre for Data Analytics. ,This item is licensed under a Creative Commons Attribution-NonCommercial-Share Alike 3.0 License. View License,24627,16 Jun 2020 16:42 by  Malika Bendechache. Last Modified 16 Jun 2020 16:42,"2016 IEEE 16th International Conference on Data Mining Workshops (ICDMW), Proceedings.1.  IEEE.",IEEE,http://dx.doi.org/10.1109/ICDMW.2016.0158,© 2016 The Authors,Science Foundation Ireland under Grant Number SFI/12/RC/2289.,,,
Malika Bendechache,Simulating fog and edge computing scenarios: an overview and research challenges.,"Svorobej, Sergej, Takako Endo, Patricia, Bendechache, Malika, Filelis-Papadopoulos, Christos, Giannoutakis, Konstantinos M., Gravvanis, George A., Tzovaras, Dimitrios, Byrne, James, Lynn, Theo","Future Internet, 11 (3)",2019,,1999-5903,Article (Published),,Yes,,,cloud computing; edge computing; fog computing; simulation; modelling; simulation challenges,Computer Science > Computer simulation,DCU Faculties and Schools > DCU Business School. DCU Faculties and Schools > Faculty of Engineering and Computing > School of Computing. Research Initiatives and Centres > ADAPT. ,,24595,10 Jun 2020 15:54 by  Malika Bendechache. Last Modified 10 Jun 2020 15:54,,MDPI,http://dx.doi.org/10.3390/fi11030055,© 2019 MDPI. Open Access,European Union’s Horizon 2020 research and innovation 415 programme grant No. 732667 (RECAP).,,,
Malika Bendechache,Parallel and distributed clustering framework for big spatial data mining.,"Bendechache, Malika, Tari, A-Kamel, Kechadi, M-Tahar","International Journal of Parallel, Emergent and Distributed Systems, 34 (6). pp. 671-689",2019,,1744-5760,Article (Published),,Yes,,,"Big Data; MapReduce; Hadoop; Spatial data mining; Clustering; Distributed
Clustering; Parallel clustering; DBSCAN; Dynamic K-means",Computer Science > Algorithms. Computer Science > Computational complexity. Computer Science > Machine learning. ,DCU Faculties and Schools > Faculty of Engineering and Computing > School of Computing. Research Initiatives and Centres > INSIGHT Centre for Data Analytics. ,This item is licensed under a Creative Commons Attribution-NonCommercial-Share Alike 3.0 License. View License,24626,16 Jun 2020 16:24 by  Malika Bendechache. Last Modified 16 Jun 2020 16:24,,Taylor & Francis,http://dx.doi.org/10.1080/17445760.2018.1446210,© 2019 Taylor & Francis,Science Foundation Ireland under Grant Number SFI/12/RC/2289.,,,
Malika Bendechache,Modelling and simulation of ElasticSearch using CloudSim.,"Bendechache, Malika, Svorobej, Sergej, Takako Endo, Patricia, Noya Mario, Manuel, Ares, M. Eduardo, Byrne, James, Lynn, Theo","IEEE/ACM 23rd International Symposium on Distributed Simulation and Real Time Applications (DS-RT), 7-9 Oct 2019, Cosenza, Italy",2019,978-1-7281-2923-5,,Conference or Workshop Item (Paper),Conference,Yes,,,ElasticSearch; CloudSim; Cloud; Workload; Query; Modelling; search engine,Computer Science > Computer simulation. Computer Science > Information storage and retrieval systems. ,DCU Faculties and Schools > DCU Business School. DCU Faculties and Schools > Faculty of Engineering and Computing > School of Computing. Research Initiatives and Centres > ADAPT. ,,24593,11 Jun 2020 10:10 by  Malika Bendechache. Last Modified 11 Jun 2020 10:10,DS-RT '19: Proceedings of the 23rd IEEE/ACM International Symposium on Distributed Simulation and Real Time Applications.1.  IEEE. ISBN 978-1-7281-2923-5,IEEE,http://dx.doi.org/10.1109/DS-RT47707.2019.8958653,© 2019 The Authors,European Union’s Horizon 2020 research and innovation programme under grant agreement No. 732667 (RECAP).,,,
Malika Bendechache,Performance evaluation of a distributed clustering approach for spatial datasets.,"Bendechache, Malika, Le-Khac, Nhien-An, Kechadi, M-Tahar","Australasian Conference on Data Mining AusDM 2017, 19-22 Aug 2017, Melbourne, VIC, Australia",2018,978-981-13-0291-6,,Conference or Workshop Item (Paper),Conference,Yes,,,"Distributed data mining; distributed computing; synchronous
communication; asynchronous communication; spacial data mining; superspeedup",Computer Science > Algorithms. Computer Science > Machine learning. ,DCU Faculties and Schools > Faculty of Engineering and Computing > School of Computing. Research Initiatives and Centres > INSIGHT Centre for Data Analytics. ,,24628,17 Jun 2020 10:11 by  Malika Bendechache. Last Modified 17 Jun 2020 10:11,"15th Australasian Conference, AusDM 2017. Communications in Computer and Information Science854.  Springer. ISBN 978-981-13-0291-6",Springer,http://dx.doi.org/10.1007/978-981-13-0292-3_3,© 2018 Springer,Science Foundation Ireland under Grant Number SFI/12/RC/2289.,,4.0,1.0
Malika Bendechache,Towards simulation and optimization of cache placement on large virtual Content Distribution Networks.,"Filelis-Papadopoulosa, Christos K., Takako Endo, Patricia, Bendechache, Malika, Svorobej, Sergej, Giannoutakisb, Konstantinos M., Gravvanisa, George A., Tzovaras, Dimitrios, Byrne, James, Lynn, Theo","Journal of computational science, 39 ",2019,,1877-7503,Article (Published),,Yes,,,vCDN; Parallel simulation; Cache placement; Simulation-based optimization,Computer Science > Computer simulation,DCU Faculties and Schools > Faculty of Engineering and Computing > School of Computing. Research Initiatives and Centres > ADAPT. ,This item is licensed under a Creative Commons Attribution-NonCommercial-Share Alike 3.0 License. View License,24470,22 May 2020 16:40 by  Malika Bendechache. Last Modified 10 Jun 2020 14:50,,Elsevier,http://dx.doi.org/10.1016/j.jocs.2019.101052,© 2019 Elsevier,,Article number 101052,,
