Research name,Publication Title,Author List,Conf/Journal Details,Citation count,Year,Filename,Ignore Y/N
Graham Healy,A baseline interactive retrieval engine for the nticr-14 lifelog-3 semantic access task,"Van-Tu Ninh, Le Tu-Khiem, Liting Zhou, Graham Healy, Minh Triet Tran, Duc Tien Dang Nguyen, Sinead Smyth, Cathal Gurrin",The Fourteenth NTCIR Conference (NTCIR-14),6,2019,,
Graham Healy,Advances in lifelog data organisation and retrieval at the ntcir-14 lifelog-3 task,"Cathal Gurrin, Hideo Joho, Frank Hopfgartner, Liting Zhou, Van-Tu Ninh, Le Tu-Khiem, Rami Albatal, Duc Tien Dang Nguyen, Graham Healy",NII Conference on Testbeds and Community for Information Access Research 16-28,2,2019,,
Graham Healy,Neural Modelling for Image Analysis,"Graham Healy, Peter Wilkins, Alan F. Smeaton, Dario Izzo, Marek Rucinski, Christos Ampatzis, Eduardo Martin Moraud",,0,2010,,
Graham Healy,The Neuroscience of Trust Violation,"Lisa Van Der Werff, Deirdre O’Shea, Graham Healy, Finian Buckley, Colette Real, Michael Keane, Theo Lynn",Academy of Management Proceedings 2020 (1) 17037,0,2020,,
Graham Healy,"Curiosity cloning: Neural modelling for image analysis, technical report","Graham Healy, Peter Wilkins, Alan F. Smeaton, Dario Izzo, Marek Rucinski, Christos Ampatzis, Eduardo Martin Moraud",Dublin City University,5,2010,,
